{
  "sampleMetadata": {
    "syntheticSample": true,
    "profileId": "RD24001-IMO-FAL-UNCEFACT-JSON-SAMPLE-1.0",
    "imoCompendiumVersion": "FAL.5/Circ.56",
    "datasetCode": "FAL2",
    "datasetName": "Cargo Declaration",
    "datasetSlug": "fal2-cargo-declaration",
    "note": "Synthetic demonstration payload; not an official IMO normative JSON message."
  },
  "messageHeader": {
    "messageFunctionCode": {
      "content": "9",
      "listId": "1225",
      "listAgencyId": "UN/EDIFACT"
    },
    "authenticationDateTime": {
      "content": "2026-09-29T00:00:00Z"
    },
    "messageId": {
      "content": "FAL2-9300049-04",
      "schemeId": "RD24001-SAMPLE"
    },
    "arrivalDepartureCode": {
      "content": "A",
      "listId": "IMO-ArrivalDeparture"
    }
  },
  "ship": {
    "imoShipNumberId": {
      "content": "9300049",
      "schemeId": "IMOShipNumber",
      "schemeAgencyId": "IMO"
    },
    "shipName": "RD PACIFIC STAR",
    "callSignId": {
      "content": "DR0004"
    },
    "mmsiNumberId": {
      "content": "440000004",
      "schemeId": "MMSI"
    },
    "flagStateId": {
      "content": "JP",
      "schemeId": "ISO3166-1-alpha2"
    },
    "shipTypeCode": {
      "content": "60",
      "listId": "UNECE-Rec28"
    },
    "shipTypeName": "Passenger ship"
  },
  "voyage": {
    "voyageId": {
      "content": "RD26-004"
    },
    "portOfDepartureCode": {
      "content": "KRPUS",
      "listId": "UNLOCODE"
    },
    "portOfDepartureName": "Busan, Republic of Korea",
    "portOfArrivalCode": {
      "content": "JPTYO",
      "listId": "UNLOCODE"
    },
    "portOfArrivalName": "Tokyo, Japan",
    "estimatedArrivalDateTime": {
      "content": "2026-09-29T00:00:00Z"
    },
    "estimatedDepartureDateTime": {
      "content": "2026-09-29T14:00:00Z"
    },
    "nextPortCode": {
      "content": "CNSHA",
      "listId": "UNLOCODE"
    },
    "nextPortName": "Shanghai, China"
  },
  "imoDataReferences": {
    "messageHeader.messageFunctionCode": "IMO0305",
    "messageHeader.arrivalDepartureCode": "IMO0013",
    "messageHeader.authenticationDateTime": "IMO0014",
    "ship.imoShipNumberId": "IMO0140",
    "ship.shipName": "IMO0142",
    "ship.callSignId": "IMO0136",
    "ship.mmsiNumberId": "IMO0326",
    "ship.flagStateId": "IMO0138",
    "voyage.portOfArrivalCode": "IMO0108",
    "voyage.portOfArrivalName": "IMO0109",
    "voyage.estimatedArrivalDateTime": "IMO0064",
    "cargoDeclaration.cargoItems[].hsCodeId": "IMO0025",
    "cargoDeclaration.cargoItems[].grossWeightMeasure": "IMO0024",
    "cargoDeclaration.cargoItems[].grossVolumeMeasure": "IMO0023",
    "cargoDeclaration.cargoItems[].transportEquipmentId": "IMO0021",
    "cargoDeclaration.cargoItems[].numberOfPackages": "IMO0028",
    "cargoDeclaration.cargoItems[].packageTypeCode": "IMO0029",
    "cargoDeclaration.transportContractId": "IMO0170"
  },
  "cargoDeclaration": {
    "transportContractId": {
      "content": "BL-9300049-004"
    },
    "cargoItems": [
      {
        "itemSequenceNumber": 1,
        "description": "Machinery parts",
        "hsCodeId": {
          "content": "848790"
        },
        "marksAndNumbers": "RD-A01",
        "grossWeightMeasure": {
          "content": 12800,
          "unitCode": "KGM"
        },
        "grossVolumeMeasure": {
          "content": 27.5,
          "unitCode": "MTQ"
        },
        "numberOfPackages": 23,
        "packageTypeCode": {
          "content": "CT",
          "listId": "UNECE-Rec21"
        },
        "transportEquipmentId": {
          "content": "RDCU0000004"
        }
      },
      {
        "itemSequenceNumber": 2,
        "description": "Electronic components",
        "hsCodeId": {
          "content": "854239"
        },
        "marksAndNumbers": "RD-B01",
        "grossWeightMeasure": {
          "content": 6440,
          "unitCode": "KGM"
        },
        "grossVolumeMeasure": {
          "content": 13.7,
          "unitCode": "MTQ"
        },
        "numberOfPackages": 15,
        "packageTypeCode": {
          "content": "BX",
          "listId": "UNECE-Rec21"
        },
        "transportEquipmentId": {
          "content": "RDCU0000014"
        }
      }
    ]
  }
}