{
  "sampleMetadata": {
    "syntheticSample": true,
    "profileId": "RD24001-IMO-FAL-UNCEFACT-JSON-SAMPLE-1.0",
    "imoCompendiumVersion": "FAL.5/Circ.56",
    "datasetCode": "FAL2",
    "datasetName": "Cargo Declaration",
    "datasetSlug": "fal2-cargo-declaration",
    "note": "Synthetic demonstration payload; not an official IMO normative JSON message."
  },
  "messageHeader": {
    "messageFunctionCode": {
      "content": "9",
      "listId": "1225",
      "listAgencyId": "UN/EDIFACT"
    },
    "authenticationDateTime": {
      "content": "2026-09-29T21:00:00Z"
    },
    "messageId": {
      "content": "FAL2-9300075-07",
      "schemeId": "RD24001-SAMPLE"
    },
    "arrivalDepartureCode": {
      "content": "A",
      "listId": "IMO-ArrivalDeparture"
    }
  },
  "ship": {
    "imoShipNumberId": {
      "content": "9300075",
      "schemeId": "IMOShipNumber",
      "schemeAgencyId": "IMO"
    },
    "shipName": "RD AMERICA BRIDGE",
    "callSignId": {
      "content": "DR0007"
    },
    "mmsiNumberId": {
      "content": "440000007",
      "schemeId": "MMSI"
    },
    "flagStateId": {
      "content": "MH",
      "schemeId": "ISO3166-1-alpha2"
    },
    "shipTypeCode": {
      "content": "70",
      "listId": "UNECE-Rec28"
    },
    "shipTypeName": "Container ship"
  },
  "voyage": {
    "voyageId": {
      "content": "RD26-007"
    },
    "portOfDepartureCode": {
      "content": "USOAK",
      "listId": "UNLOCODE"
    },
    "portOfDepartureName": "Oakland, United States",
    "portOfArrivalCode": {
      "content": "USLAX",
      "listId": "UNLOCODE"
    },
    "portOfArrivalName": "Los Angeles, United States",
    "estimatedArrivalDateTime": {
      "content": "2026-09-29T21:00:00Z"
    },
    "estimatedDepartureDateTime": {
      "content": "2026-09-30T11:00:00Z"
    },
    "nextPortCode": {
      "content": "JPTYO",
      "listId": "UNLOCODE"
    },
    "nextPortName": "Tokyo, Japan"
  },
  "imoDataReferences": {
    "messageHeader.messageFunctionCode": "IMO0305",
    "messageHeader.arrivalDepartureCode": "IMO0013",
    "messageHeader.authenticationDateTime": "IMO0014",
    "ship.imoShipNumberId": "IMO0140",
    "ship.shipName": "IMO0142",
    "ship.callSignId": "IMO0136",
    "ship.mmsiNumberId": "IMO0326",
    "ship.flagStateId": "IMO0138",
    "voyage.portOfArrivalCode": "IMO0108",
    "voyage.portOfArrivalName": "IMO0109",
    "voyage.estimatedArrivalDateTime": "IMO0064",
    "cargoDeclaration.cargoItems[].hsCodeId": "IMO0025",
    "cargoDeclaration.cargoItems[].grossWeightMeasure": "IMO0024",
    "cargoDeclaration.cargoItems[].grossVolumeMeasure": "IMO0023",
    "cargoDeclaration.cargoItems[].transportEquipmentId": "IMO0021",
    "cargoDeclaration.cargoItems[].numberOfPackages": "IMO0028",
    "cargoDeclaration.cargoItems[].packageTypeCode": "IMO0029",
    "cargoDeclaration.transportContractId": "IMO0170"
  },
  "cargoDeclaration": {
    "transportContractId": {
      "content": "BL-9300075-007"
    },
    "cargoItems": [
      {
        "itemSequenceNumber": 1,
        "description": "Machinery parts",
        "hsCodeId": {
          "content": "848790"
        },
        "marksAndNumbers": "RD-A01",
        "grossWeightMeasure": {
          "content": 13100,
          "unitCode": "KGM"
        },
        "grossVolumeMeasure": {
          "content": 30.5,
          "unitCode": "MTQ"
        },
        "numberOfPackages": 26,
        "packageTypeCode": {
          "content": "CT",
          "listId": "UNECE-Rec21"
        },
        "transportEquipmentId": {
          "content": "RDCU0000007"
        }
      },
      {
        "itemSequenceNumber": 2,
        "description": "Electronic components",
        "hsCodeId": {
          "content": "854239"
        },
        "marksAndNumbers": "RD-B01",
        "grossWeightMeasure": {
          "content": 6680,
          "unitCode": "KGM"
        },
        "grossVolumeMeasure": {
          "content": 15.2,
          "unitCode": "MTQ"
        },
        "numberOfPackages": 18,
        "packageTypeCode": {
          "content": "BX",
          "listId": "UNECE-Rec21"
        },
        "transportEquipmentId": {
          "content": "RDCU0000017"
        }
      }
    ]
  }
}